### ISSUE TITLE
Deploy from company firewall

### ISSUE THREAD

**Issue by BardiaAfshin** [serverless/serverless#3256]
# This is a (Bug Report / Feature Proposal)

## Description

For bug reports:
* What went wrong?
* What did you expect should have happened?
* What was the config you used?
* What stacktrace or error message from your provider did you see?

For feature proposals:
* Deploying from behind corporate firewall with multiple IAM roles (dev/prod/etc)
Similar or dependent issues:
http://forum.serverless.com/t/deploying-with-role-behind-company-firewall/1335

## Additional Data

* ***Serverless Framework Version you're using***: v1.7.0
* ***Operating System***: mac os x (Darwin)
* ***Stack Trace***: 
```trace
Error: ServerlessError: ServerlessError: connect ETIMEDOUT 54.239.28.247:443
at module.exports.logError.errorHandlingError (/usr/local/lib/node_modules/serverless/lib/classes/Error.js:90:11)
at BbPromise.resolve.then.catch.e (/usr/local/lib/node_modules/serverless/bin/serverless:26:3)
at runCallback (timers.js:649:20)
at tryOnImmediate (timers.js:622:5)
at processImmediate as _immediateCallback
From previous event:
at _dirname (/usr/local/lib/nodemodules/serverless/bin/serverless:24:9)
at Object. (/usr/local/lib/node_modules/serverless/bin/serverless:27:4)
at Module._compile (module.js:570:32)
at Object.Module._extensions..js (module.js:579:10)
at Module.load (module.js:487:32)
at tryModuleLoad (module.js:446:12)
at Function.Module._load (module.js:438:3)
at Module.runMain (module.js:604:10)
at run (bootstrap_node.js:394:7)
at startup (bootstrap_node.js:149:9)
at bootstrap_node.js:509:3
```
* ***Provider Error messages***:
 ServerlessError: ServerlessError: connect ETIMEDOUT
 54.239.28.247:443

 For debugging logs, run again after setting the "SLS_DEBUG=*" environment variable.

**Comment by andymac4182** [comment]
Can you access AWS from your machine? Can you use the CLI tools on your machine to connect to AWS?

**Comment by jdchmiel** [comment]
do you have a socks proxy?  I have the same issue if I have serverless run tasks such as 'sls dynamodb install' as that does not seem to care what proxy is in the npm config. a regular sls deploy does work, but then I cannot reach dynamodb or any other aws resources unless I set up the socks proxy in addition to the regular http / https.

**Comment by BardiaAfshin** [comment]
I sometimes have to set the proxy to be able to access the AWS from CLI. But not always.

**Comment by BardiaAfshin** [comment]
Also, who's IP address is that? 54.239.28.247:443

**Comment by str3tch** [comment]
I have the same issue.. I can use the aws cli fine. But I get this when using 1.15.2:

Serverless: Packaging service...

  Serverless Error ---------------------------------------

  ServerlessError: connect ETIMEDOUT 54.239.29.24:443

**Comment by jrbenito** [comment]
I do access aws through cli with proxy variables set, also npm do work. However, can´t deploy from serverless, it seems to ignore proxy settings somehow.

**Comment by pmuens** [comment]
Hey @jrbenito thanks for commenting :+1:.

Could you describe the steps you took to set the proxy variable?

**Comment by jrbenito** [comment]
Hi @pmuens ,

I did `export https_proxy=https://user:name@IP:8080/`  and same for http_proxy variable. However, looking deeper into the issue, I do use aws cli with no problem, but it is written in python. Hence, I did a small node program that import aws-sdk, import proxy agent set as explained by AWS documentation and it also end in hang up issues. So, no severless issue but aws-sdk + proxy agent + proxy issue.

During issue is checked `netstat` and saw a TCP connection from node process to the proxy at port 8080 established, however, after a long period it hang up. I conclude the proxy configuration is correct since it is being used by serverless and my small node proof of concept program but something is going wrong after reach the proxy. I will debug more with company´s IT support.

Sorry for wrong report.

Thanks,

**Comment by pmuens** [comment]
Thanks for getting back @jrbenito :+1:

No problem! Let us know if you still face related problems with Serverless

**Comment by jrbenito** [comment]
Hi guys,

I did a lot of tests and packets captures with `tcpdump`, also posted [question to stackoverflow](https://stackoverflow.com/a/44980740/2726840) and [opened aws-sdk project issue](https://github.com/aws/aws-sdk-js/issues/1619#issuecomment-313790612).

Based on that I was able to make `aws-sdk` work from behind corporate proxy using tunnel-agent type `httpsOverHttp`. So, to make serverless work I need to edit [`plugins/aws/provider/awsProvider.js` line 115](https://github.com/serverless/serverless/blob/master/lib/plugins/aws/provider/awsProvider.js#L115) to `proxyOptions.secureEndpoint = false;` making it stablish a HTTPS tunnel over HTTP proxy.

While my proxy do have `https` endpoint, I don´t know why `CONNECT` method is not usable through that endpoint but perfectly accepted over plain `http`.

If there is a way to make this modification a option in the `serverless.yml` it would be good not to edit serverless source code. It is **important to notice** that communication with  AWS is still conducted in cryptographic fashion as show below:

```
 No.     Time           Source                Destination           Protocol Length Info
      1 0.000000       105.103.15.106        105.103.82.47         TCP      74     56308 → 8080 [SYN] Seq=0 Win=29200 Len=0 MSS=1460 SACK_PERM=1 TSval=562887667 TSecr=0 WS=128
      2 0.001968       105.103.82.47         105.103.15.106        TCP      74     8080 → 56308 [SYN, ACK] Seq=0 Ack=1 Win=14480 Len=0 MSS=1460 SACK_PERM=1 TSval=3661633605 TSecr=562887667 WS=128
      3 0.001990       105.103.15.106        105.103.82.47         TCP      66     56308 → 8080 [ACK] Seq=1 Ack=1 Win=29312 Len=0 TSval=562887667 TSecr=3661633605
      4 0.002491       105.103.15.106        105.103.82.47         HTTP     198    CONNECT cloudformation.us-east-1.amazonaws.com:443 HTTP/1.1 
      5 0.004586       105.103.82.47         105.103.15.106        TCP      66     8080 → 56308 [ACK] Seq=1 Ack=133 Win=15616 Len=0 TSval=3661633608 TSecr=562887667
      6 0.464613       105.103.82.47         105.103.15.106        HTTP     185    HTTP/1.1 200 Connection established 
      7 0.464622       105.103.15.106        105.103.82.47         TCP      66     56308 → 8080 [ACK] Seq=133 Ack=120 Win=29312 Len=0 TSval=562887783 TSecr=3661634069
      8 0.467549       105.103.15.106        105.103.82.47         TLSv1.2  357    Client Hello
      9 0.469590       105.103.82.47         105.103.15.106        TCP      66     8080 → 56308 [ACK] Seq=120 Ack=424 Win=16640 Len=0 TSval=3661634073 TSecr=562887783
     10 0.873622       105.103.82.47         105.103.15.106        TLSv1.2  1995   Server Hello
     11 0.873631       105.103.15.106        105.103.82.47         TCP      66     56308 → 8080 [ACK] Seq=424 Ack=2049 Win=33152 Len=0 TSval=562887885 TSecr=3661634478
     12 0.873871       105.103.82.47         105.103.15.106        TLSv1.2  1488   CertificateServer Key Exchange, Server Hello Done
     13 0.876954       105.103.15.106        105.103.82.47         TLSv1.2  216    Client Key Exchange, Change Cipher Spec, Encrypted Handshake Message
     14 0.878593       105.103.82.47         105.103.15.106        TCP      66     8080 → 56308 [ACK] Seq=3471 Ack=574 Win=17792 Len=0 TSval=3661634482 TSecr=562887886
     15 1.149606       105.103.82.47         105.103.15.106        TLSv1.2  141    Change Cipher Spec, Encrypted Handshake Message
     16 1.152408       105.103.15.106        105.103.82.47         TLSv1.2  823    Application Data
     17 1.154598       105.103.82.47         105.103.15.106        TCP      66     8080 → 56308 [ACK] Seq=3546 Ack=1331 Win=20608 Len=0 TSval=3661634758 TSecr=562887955
     18 1.501901       105.103.82.47         105.103.15.106        TLSv1.2  617    Application Data
     19 1.501908       105.103.82.47         105.103.15.106        TLSv1.2  778    Application DataEncrypted Alert
     20 1.501927       105.103.15.106        105.103.82.47         TCP      66     56308 → 8080 [ACK] Seq=1331 Ack=4809 Win=41856 Len=0 TSval=562888042 TSecr=3661635106
     21 1.506648       105.103.15.106        105.103.82.47         TLSv1.2  119    Encrypted Alert
     22 1.507291       105.103.15.106        105.103.82.47         TCP      66     56308 → 8080 [FIN, ACK] Seq=1384 Ack=4809 Win=41856 Len=0 TSval=562888043 TSecr=3661635106
     23 1.508599       105.103.82.47         105.103.15.106        TCP      66     8080 → 56308 [ACK] Seq=4809 Ack=1384 Win=20608 Len=0 TSval=3661635112 TSecr=562888043
     24 1.547650       105.103.82.47         105.103.15.106        TCP      66     8080 → 56308 [ACK] Seq=4809 Ack=1385 Win=20608 Len=0 TSval=3661635152 TSecr=562888043
     30 1.801989       105.103.82.47         105.103.15.106        TCP      66     8080 → 56308 [FIN, ACK] Seq=4809 Ack=1385 Win=20608 Len=0 TSval=3661635407 TSecr=562888043
     31 1.802000       105.103.15.106        105.103.82.47         TCP      66     56308 → 8080 [ACK] Seq=1385 Ack=4810 Win=41856 Len=0 TSval=562888117 TSecr=3661635407
```

Thanks and best regards.
Benito.

**Comment by pmuens** [comment]
Thanks for taking a deep dive into it @jrbenito 👍 

> If there is a way to make this modification a option in the serverless.yml it would be good not to edit serverless source code.

That sounds like a good addition to `serverless.yml`. Any idea / proposal how this config parameter could look like? We could add it to the `provider` section since it's AWS related.

**Comment by jrbenito** [comment]
Hi there,

I think it could be a command line modifier like `--aws-proxy-secureendpoint=false` or inside `serverless.yml` like: 

```
proxy:
   secureendpoint: false
```

However, since someone can be working in a project inside office, hence behind corporate proxy, and sometimes from a home office or biz trip, it makes more sense to use command line modifier since `severless.yml` are versioned and sometimes shared among developers.

Is this reasonable?

**Comment by pmuens** [comment]
Thanks for the proposal @jrbenito 👍 

That looks good so far! Only two minor suggestions:

I'd suggest to nest the config inside the `provider` section since it's AWS related. So something like this:

```yml
provider:
  secureEndpoint: true
```

or:

```
provider:
  proxy:
    secureEndpoint: true
```

But I'm not sure if a nesting in `proxy` is necessary so I prefer the first config.

Could we potentially add other configs to the `proxy`?

Other than that I'd propose to add camelcase for the option like this:

```
--aws-secureEndpoint=false
```

or:

```
--aws-proxy-secureEndpoint=false
```

so that it's consistent throughout our codebase.

Thanks again for jumping in and providing a proposal @jrbenito 👍 💯!

**Comment by awildturtok** [comment]
I have tried applying @jrbenito's fix, but am still getting the same error message reported. I am running sereverless on windows, if that might be of concern.

> Serverless: Packaging service...
> Serverless Error ---------------------------------------
> 
>   ServerlessError: self signed certificate in certificate chain
> 
>   Get Support --------------------------------------------
>      Docs:          docs.serverless.com
>      Bugs:          github.com/serverless/serverless/issues
>      Forums:        forum.serverless.com
>      Chat:          gitter.im/serverless/serverless
> 
>   Your Environment Information -----------------------------
>      OS:                     win32
>      Node Version:           6.10.0
>      Serverless Version:     1.18.0

**Comment by jrbenito** [comment]
@awildturtok ,

The error `ServerlessError: self signed certificate in certificate chain` is related to certificate used by the proxy. It is a self-signed certificate not trusted (by default). To circumvent this error you need to add the CA certificate used to sign proxy´s certificate to the trusted CAs list. The CA Certificate should be provided by your proxy/IT administrator and, in order to install it, follow [Microsoft´s instructions](https://technet.microsoft.com/en-us/library/cc731183(v=ws.11).aspx) (I never tested).  Another option is instruct Node to ignore SSL verification with [something like this](https://stackoverflow.com/questions/10888610/ignore-invalid-self-signed-ssl-certificate-in-node-js-with-https-request).

Let me know if you managed to do it.

**Comment by awildturtok** [comment]
Keys should already be installed, and going through the steps of installing them, I saw some keys that looked fitting. 

Using the NODE_TLS_REJECT_UNAUTHORIZED=0 method seems to work, but I will have to investigate this further so that we can use this. Thanks for your input!

**Comment by scourc** [comment]
Hi,
I was facing similar issue (proxy with unsecure endpoint+ self-signed root CA), and finally found a solution working in my environment at least.

I'm posting it here as it might help others (and fighting with proxies is so time and nerve-consuming ! ;-) ).

The issue is in file awsProvider.js (lib/plugins/aws/provider): if you specify *both* a proxy and CA certificate options, the http agent will be set to fit the CA options only, overwriting the http agent set by the proxy options.
As a consequence, you can only have one or the other, but not both proxy and CA.
To fix this, I :  
* moved the proxyOptions declaration out of the "if (proxy)...", still leaving the declaration of the http agent inside the "if (proxy)" block, 
* and then changed the "if (caCerts.length > 0)" block to this :
```javascript
if (caCerts.length > 0) {
      const caOptions = {
        rejectUnauthorized: true,
        ca: caCerts,
      };
      if (proxy) {
	      Object.assign(caOptions,AWS.config.httpOptions.agent);
      }
      // Update the agent -- http://docs.aws.amazon.com/sdk-for-javascript/v2/developer-guide/node-registering-certs.html
      //AWS.config.httpOptions.agent = new https.Agent(caOptions);
      var agent = require('tunnel-agent').httpsOverHttp(caOptions);
      //console.log(caOptions);
      AWS.config.httpOptions.agent = agent;
    }
```
Then by exporting an environment variable called "ca" with the *content* of the certificate (the PEM string) and another variable "proxy" with the proxy endpoint, I could deploy from behind my proxy.

**Comment by gitgoose** [comment]
Was this ever figured -- i mean how to get it solved with a serverless.yml config?

**Comment by mdiez19** [comment]
I set `NODE_EXTRA_CA_CERTS` env variable to the same value as `AWS_CA_BUNDLE`. Might not work for all, but I hope it will work for some (like me).

**Comment by datoml** [comment]
In case anyone still has troubles to deploy to AWS I used a hacky solution for this.
I made an edit in the `awsProvider.js` inside the global serverless provider module (`.npm-global/lib/node_modules/serverless/lib/plugins/aws/provider`).

```js
 // Use HTTPS Proxy (Optional)
    const proxy = process.env.proxy
      || process.env.HTTP_PROXY
      || process.env.http_proxy
      || process.env.HTTPS_PROXY
      || process.env.https_proxy
      || 'http://your-awesome-proxy:port';
```
Maybe it helps someone. :)
